"1","In this phase you learn about ruby...as well as all about your feelings"
"2","In this phase you learn about how the web works...yes the whole web"
"3","If you can make it to this phase before jumping out of a window, you learn rails"
"JH","This guy drinks a lot of tea"
"Cole","Inventor of the sweetest terminal chat ever"
"24","The amount of hours you need to spend coding per day during DBC to pass"
"KT","Doesn't celebrate the fourth of July, but likes the YMCA"
"python","Programming language named after a funny british movie series"
